{"$id":"https://agent-development-skills.local/design/design-evidence-v1.schema.json","$schema":"https://json-schema.org/draft/2020-12/schema","additionalProperties":false,"properties":{"evidence_id":{"minLength":1,"type":"string"},"permission":{"additionalProperties":false,"properties":{"approval_id":{"type":["string","null"]},"mode":{"enum":["read","export","write"]}},"required":["mode","approval_id"],"type":"object"},"schema_version":{"const":"1.0"},"slices":{"items":{"additionalProperties":false,"properties":{"id":{"minLength":1,"type":"string"},"kind":{"enum":["screen","region","component","token","asset"]},"payload":{"type":"object"},"provenance":{"additionalProperties":false,"properties":{"confidence":{"maximum":1,"minimum":0,"type":"number"},"evidence_ref":{"type":["string","null"]},"kind":{"enum":["source","manual-contract","inference","unknown"]}},"required":["kind","evidence_ref","confidence"],"type":"object"}},"required":["id","kind","payload","provenance"],"type":"object"},"minItems":1,"type":"array"},"source":{"additionalProperties":false,"properties":{"content_sha256":{"pattern":"^[0-9a-f]{64}$","type":"string"},"document_id":{"minLength":1,"type":"string"},"document_version":{"minLength":1,"type":"string"},"kind":{"enum":["figma","sketch","manual","screenshot"]},"parser":{"additionalProperties":false,"properties":{"name":{"minLength":1,"type":"string"},"version":{"minLength":1,"type":"string"}},"required":["name","version"],"type":"object"},"scope":{"additionalProperties":false,"properties":{"node_ids":{"items":{"minLength":1,"type":"string"},"minItems":1,"type":"array","uniqueItems":true},"page_id":{"type":["string","null"]}},"required":["page_id","node_ids"],"type":"object"}},"required":["kind","document_id","document_version","scope","content_sha256","parser"],"type":"object"},"status":{"enum":["complete","partial","blocked"]},"unknowns":{"items":{"additionalProperties":false,"properties":{"blocking":{"type":"boolean"},"id":{"minLength":1,"type":"string"},"reason":{"minLength":1,"type":"string"}},"required":["id","reason","blocking"],"type":"object"},"type":"array"}},"required":["schema_version","evidence_id","source","permission","slices","unknowns","status"],"title":"Design Evidence v1","type":"object"}
