{"evidence_id":"evidence-35d10c178ade91a8","permission":{"approval_id":null,"mode":"read"},"schema_version":"1.0","slices":[{"id":"settings","kind":"screen","payload":{"accessibility":{"dynamic_type":true,"reduce_motion":true,"voice_over":true},"assets":[{"id":"icon.save","semantic":"save"}],"interactions":[{"event":"tap","from":"default","id":"save","to":"loading"}],"regions":[{"components":[{"id":"save-button","slots":{"label":"Save"},"states":["default","disabled","pressed"],"token_refs":["color.action.primary"],"type":"button","variant":"primary"}],"id":"footer","layout":{"alignment":"trailing","kind":"stack"}}],"responsive":{"compact":{"footer":"fill"}},"states":["default","loading"]},"provenance":{"confidence":0.5,"evidence_ref":"evidence-35d10c178ade91a8","kind":"inference"}}],"source":{"content_sha256":"35d10c178ade91a8bbd1780dc808862a8e52c6df47130f0cb03f9e4dbd333938","document_id":"settings-document","document_version":"42","kind":"screenshot","parser":{"name":"screenshot-adapter","version":"1.0.0"},"scope":{"node_ids":["settings"],"page_id":"settings-page"}},"status":"partial","unknowns":[{"blocking":true,"id":"structured-states-unavailable","reason":"Screenshot fallback cannot prove hidden states or interaction semantics."}]}
