{"evidence_id":"evidence-0e0733ca1bf349ec","permission":{"approval_id":null,"mode":"read"},"schema_version":"1.0","slices":[{"id":"settings","kind":"screen","payload":{"accessibility":{"dynamic_type":true,"reduce_motion":true,"voice_over":true},"assets":[{"id":"icon.save","semantic":"save"}],"interactions":[{"event":"tap","from":"default","id":"save","to":"loading"}],"regions":[{"components":[{"id":"save-button","slots":{"label":"Save"},"states":["default","disabled","pressed"],"token_refs":["color.action.primary"],"type":"button","variant":"primary"}],"id":"footer","layout":{"alignment":"trailing","kind":"stack"}}],"responsive":{"compact":{"footer":"fill"}},"states":["default","loading"]},"provenance":{"confidence":0.75,"evidence_ref":"evidence-0e0733ca1bf349ec","kind":"manual-contract"}}],"source":{"content_sha256":"0e0733ca1bf349ec0af0bbc0401851057d170316e03025fd563ff25c7fb26dc2","document_id":"settings-document","document_version":"42","kind":"manual","parser":{"name":"manual-adapter","version":"1.0.0"},"scope":{"node_ids":["settings"],"page_id":"settings-page"}},"status":"complete","unknowns":[]}
