{"evidence_id":"evidence-5437d4abcb50d8ae","permission":{"approval_id":null,"mode":"read"},"schema_version":"1.0","slices":[{"id":"settings","kind":"screen","payload":{"accessibility":{"dynamic_type":true,"reduce_motion":true,"voice_over":true},"assets":[{"id":"icon.save","semantic":"save"}],"interactions":[{"event":"tap","from":"default","id":"save","to":"loading"}],"regions":[{"components":[{"id":"save-button","slots":{"label":"Save"},"states":["default","disabled","pressed"],"token_refs":["color.action.primary"],"type":"button","variant":"primary"}],"id":"footer","layout":{"alignment":"trailing","kind":"stack"}}],"responsive":{"compact":{"footer":"fill"}},"states":["default","loading"]},"provenance":{"confidence":1.0,"evidence_ref":"evidence-5437d4abcb50d8ae","kind":"source"}}],"source":{"content_sha256":"5437d4abcb50d8aeda5ed39ae4a7f30874cb9d946e52ef35360787b8e57b72a1","document_id":"settings-document","document_version":"42","kind":"sketch","parser":{"name":"sketch-adapter","version":"1.0.0"},"scope":{"node_ids":["settings"],"page_id":"settings-page"}},"status":"complete","unknowns":[]}
