{"evidence_id":"evidence-80a00c9e42a17c9a","permission":{"approval_id":null,"mode":"read"},"schema_version":"1.0","slices":[{"id":"settings","kind":"screen","payload":{"accessibility":{"dynamic_type":true,"reduce_motion":true,"voice_over":true},"assets":[{"id":"icon.save","semantic":"save"}],"interactions":[{"event":"tap","from":"default","id":"save","to":"loading"}],"regions":[{"components":[{"id":"save-button","slots":{"label":"Save"},"states":["default","disabled","pressed"],"token_refs":["color.action.primary"],"type":"button","variant":"primary"}],"id":"footer","layout":{"alignment":"trailing","kind":"stack"}}],"responsive":{"compact":{"footer":"fill"}},"states":["default","loading"]},"provenance":{"confidence":1.0,"evidence_ref":"evidence-80a00c9e42a17c9a","kind":"source"}}],"source":{"content_sha256":"80a00c9e42a17c9ac17dc631d599b32b8dacd3215a48476d18cf38e48114fc36","document_id":"settings-document","document_version":"42","kind":"figma","parser":{"name":"figma-adapter","version":"1.0.0"},"scope":{"node_ids":["settings"],"page_id":"settings-page"}},"status":"complete","unknowns":[]}
